{
  "schema_id": "ywe.location_branch_overlay.v1",
  "version": "1.0.0",
  "overlay_id": "overlay.ravenfall_gate.oath_concealed",
  "location_id": "ravenfall_gate",
  "branch_id": "branch.ravenfall.example",
  "truth_scope": "leaf_branch_truth",
  "source_refs": {
    "worldstate_delta_refs": [
      "delta.ravenfall_gate.oath_concealed"
    ],
    "branch_event_ref": "branch_event.ravenfall_gate.oath_concealed",
    "player_state_snapshot_ref": "player_state.snapshot.example",
    "location_state_record_ref": "location_state.ravenfall_gate.oath_concealed"
  },
  "overlay_body": {
    "visible_changes": [
      "surface market appears unchanged"
    ],
    "access_changes": [
      "hidden shadow path conditional"
    ],
    "eligibility_changes": [
      "keeper_npc_generation_candidate",
      "secret_oath_lore_candidate"
    ],
    "perception_changes": [
      "Shadow-plane silence thickens near sealed stair"
    ],
    "myth_pressure_refs": [
      "myth.seed.ravenfall_gate.secret_keeper"
    ],
    "prophecy_pressure_refs": []
  },
  "future_generation_bias_refs": [
    "bias.ravenfall_gate.oath_concealed"
  ],
  "validation": {
    "does_not_rewrite_base_ontology": true,
    "does_not_claim_shared_truth_without_delta": true,
    "is_runtime_generated_not_pregenerated_tree": true
  }
}
